<?xml version="1.0"?>
<xsd:schema xmlns:xsd="http://www.w3.org/2001/XMLSchema"
            targetNamespace="http://www.books.org"
            xmlns="http://www.books.org"
            elementFormDefault="qualified">

    <xsd:element name="bookstore">
        <xsd:complexType>
            <xsd:sequence>
                <xsd:element name="book" minOccurs="1" maxOccurs="unbounded">
                    <xsd:complexType>
                        <xsd:sequence>
                            <xsd:element name="title" type="xsd:string"/>
                            <xsd:element name="chapter" minOccurs="1" maxOccurs="unbounded">
                                <xsd:complexType>
                                    <xsd:sequence>
                                        <xsd:element name="number" type="xsd:integer"/>
                                        <xsd:element name="title" type="xsd:string"/>
                                    </xsd:sequence>
                                </xsd:complexType>
                            </xsd:element>
                            <xsd:element name="price" minOccurs="1" maxOccurs="unbounded" type="xsd:double"/>
                        </xsd:sequence>
                    </xsd:complexType>
                </xsd:element>
            </xsd:sequence>
        </xsd:complexType>
    </xsd:element>
</xsd:schema>
